{
  "name": "shell",
  "filename": "remoteEntry.js",
  "remotes": {
    "dashboard": "dashboard@http://localhost:3000/moxjs/remotes/dashboard/remoteEntry.js"
  },
  "shared": {
    "react": {
      "singleton": true,
      "requiredVersion": false
    },
    "react-dom": {
      "singleton": true,
      "requiredVersion": false
    },
    "@moxjs/event-bus": {
      "singleton": true,
      "requiredVersion": false
    },
    "@moxjs/runtime": {
      "singleton": true,
      "requiredVersion": false
    },
    "@moxjs/state": {
      "singleton": true,
      "requiredVersion": false
    }
  }
}
